{"source_id":"33333333-3333-4333-8333-333333333333","source_type":"speech","origin":"owner-recorded synthetic example","acquisition_method":"documented local recording","rights_status":"owned","character_id":"miku","language":"ko-KR","raw_duration":12.5,"provenance":{"consent":"owner","registry_revision":"1"},"hash":"sha256:aaaaaaaaaaaaaaaaaaaaaaaaaaaaaaaaaaaaaaaaaaaaaaaaaaaaaaaaaaaaaaaa","status":"accepted"}
